{
  "schema_version": "1.0",
  "prediction_id": "lol-s-tier-2026-07-24-1048",
  "stage": "primary",
  "generated_at": "2026-07-24T11:02:00+08:00",
  "model": "current-session-gpt-5",
  "reasoning_effort": null,
  "thesis": "台灣時間 2026-07-24 的 S Tier LoL 正式範圍為三場 LPL BO3。主模型依序選 AL、JDG、BLG，但只有 BLG 的勝方方向較穩；AL-LGD 與 WE-JDG 都受單一同版本系列、小樣本與 Game 1 選邊未定影響，不應把品牌先驗寫成穩勝。",
  "analysis_sections": [
    {
      "heading": "1. 賽程完整性、快照與資料狀態",
      "markdown": "- 資料截止：2026-07-24 10:48（UTC+8），快照為 `pre-lineup / pre-draft`。\n- 今日正式納入：15:00 AL–LGD、17:00 WE–JDG、19:00 EDG–BLG，均為 LPL Split 3 Group Ascend BO3、Fearless Draft。\n- 完整性處理：bo3.gg 與 LPL 賽程頁對三場 LPL 一致。Leaguepedia／Liquipedia 曾把 LCP Split 3 列為 7/24，但 Riot 7/13 最新官方公告明確寫 7/25 開幕，因此移除原候選的 SHG–TSW、CFO–DCG。這是已消解的來源衝突，不是遺漏。\n- 版本：7/23 LPL 已使用 16.14；今日賽事頁尚未逐場填入版本，故以 16.14 作高可信推估。正式比賽頁若臨時顯示不同版本，應建立新版快照。\n- 限制：未完整逐場複盤官方全長 VOD；近期判斷以實際出賽名單、局內數據、BP／版本紀錄與賽後回顧為主。三場 G1 選邊均未確認。"
    },
    {
      "heading": "2. Patch 16.14 與今日共同 BP 主軸",
      "markdown": "26.14 對職業賽最直接的變化是 Azir 互動增強、Yunara 成長 AD 提升、Nami E 強化，以及 6／11 級後藍 Buff 提供更多技能急速；另一側是 Jayce 的跑速與抗性下修、Senna 與 Seraphine 下路體系削弱。這使今日 BP 更重視三件事：\n\n1. **中路穩定線權與後期輸出**：Shanks、HongQ、Knight 都能從控制法師與 Azir 類結構受益；EDG 新中路 Bulldog 則仍在與隊伍磨合。\n2. **ADC 大核與下路保護**：Hope、GALA、Viper 都能使用後期大核；Yunara 加強使純粹靠 ban 一個 ADC 解題更困難。Leave 也有單點 carry 路徑，但 EDG 必須先把中野與輔助死亡數壓下來。\n3. **打野第一輪與藍 Buff 節奏**：Tarzan、JunJia、Xun 的中期技能循環會更有價值。對 LGD 而言，Heng 7/22 的中野連動是可重複優勢；對 JDG 而言，JunJia 7/23 的前期落後則是必須修正的警訊。\n\nFearless Draft 會放大第二局後的英雄池與局間調整差異；因此本模型沒有把每局視為固定同勝率。"
    },
    {
      "heading": "3. Anyone's Legend vs LGD Gaming — 15:00",
      "markdown": "**可能先發**\n\n| 位置 | Anyone's Legend | LGD Gaming |\n|---|---|---|\n| Top | Flandre | Burdol |\n| Jungle | Tarzan | Heng |\n| Mid | Shanks | Tangyuan |\n| ADC | Hope | Shaoye |\n| Support | Kael | Crisp |\n\n**近期內容與權重仲裁**\n\nAL 7/23 以 2-1 擊敗 JDG，證明其 BO3 決勝局的耐心與後期資源管理仍在；但決勝局拖長也顯示前中期未形成乾淨關門。LGD 7/22 對 EDG 的 2-0 更乾淨：兩局合計 41-22 擊殺、18-7 塔、5-1 巴龍，Heng–Tangyuan 的中野與 Shaoye 的輸出銜接都有效。另一方面，AL 6/5 曾在 Split 2 季後賽 3-0 LGD；因 BO5 外推 BO3，該 H2H 只當收縮先驗，權重不高於當前可比內容的一半。\n\n**對位與取圖路徑**\n\n- AL 路徑一：Tarzan 配合 Shanks 先取得中路線權，提早進入河道，讓 Hope 的後期輸出不必承擔逆風開戰。\n- AL 路徑二：Flandre 使用弱側可自理上路，將 BP 與資源投向下半區；Fearless G2 再切換控制法師＋大核結構。\n- LGD 路徑一：延續 7/22 的 Heng–Tangyuan 主動中野，搶先掌握第一輪小龍／巢蟲並迫使 Tarzan 回應。\n- LGD 路徑二：Crisp 提早離線製造多打少，讓 Shaoye 在二件套前建立輸出空間。若 AL 再度把比賽拖到 40 分鐘以上，LGD 的團戰爆發仍可延伸到決勝局。\n\n**反模型**：基準強度模型 AL 82%；同賽事近期模型 AL 74%；假設 LGD 取得有利 G1 選邊並複製中野節奏的弱方模型 AL 68%。最大差距 14 個百分點，因此點估計收在 AL 77%，敏感區間約 68%–82%。AL 為勝方傾向，但不是穩勝。"
    },
    {
      "heading": "4. Team WE vs JD Gaming — 17:00",
      "markdown": "**可能先發**\n\n| 位置 | Team WE | JD Gaming |\n|---|---|---|\n| Top | Cube | Xiaoxu |\n| Jungle | Monki（Tyrion 為替補） | JunJia |\n| Mid | Karis | HongQ |\n| ADC | About | GALA |\n| Support | Erha | Vampire |\n\n**近期內容與權重仲裁**\n\nWE 7/22 被 TES 2-0，About 兩局雖維持輸出量，但隊伍沒有把下路資源轉成物件控制。更早的 Split 2 季後賽，WE 曾先後 3-0 AL、3-1 BLG，之後又 0-3 TES、2-3 BLG；這組樣本說明 WE 有兩套上限：Cube 單帶／邊線壓力，以及 About 作主輸出的團戰，但系列間穩定性不足。JDG 7/23 以 1-2 輸給 AL，決勝局拖至約 56 分鐘仍未收掉，JunJia 的前期落後與中期資源轉換是明顯問題。\n\n**對位與取圖路徑**\n\n- JDG 路徑一：JunJia 先服務 HongQ，讓中路先動後支援 GALA；GALA 的大核收尾是全系列最穩的單一勝點。\n- JDG 路徑二：Xiaoxu 以對線主動英雄迫使 Cube 留在線上，減少 WE 的邊線牽制，再由 Vampire 配合先手開團。\n- WE 路徑一：Cube 在邊線取得 TP 與兵線主動，逼 JDG 分散資源，About 在正面打前排。\n- WE 路徑二：Monki–Karis 利用 JDG 昨日暴露的中野前期空檔，先取得巢蟲／第一塔，把比賽縮短在 GALA 三件套前。\n\n**為何 WE 能拿圖但仍非系列熱門**：WE 的兩條路徑都能重複，但需要 Cube 或中野至少一側先贏；JDG 即使輸掉 G1，仍有 GALA 後期與 BO3 敗方選邊兩個修正來源。基準模型 JDG 66%、同賽事模型 60%、WE 反模型下 JDG 55%，最大差距 11 個百分點；點估計 JDG 63%，敏感區間 55%–66%。這是今日最接近的一場。"
    },
    {
      "heading": "5. EDward Gaming vs Bilibili Gaming — 19:00",
      "markdown": "**可能先發**\n\n| 位置 | EDward Gaming | Bilibili Gaming |\n|---|---|---|\n| Top | Zdz | Wenbo（Bin 仍在 roster，當場待確認） |\n| Jungle | Xiaohao | Xun |\n| Mid | Bulldog | Knight |\n| ADC | Leave | Viper |\n| Support | Parukia | ON |\n\n**近期內容與權重仲裁**\n\nEDG 7/22 以新中路 Bulldog 出戰，0-2 輸給 LGD；兩局合計僅 7 塔、1 巴龍，Parukia 2/11/12，顯示問題不只是單線輸贏，而是中期站位、先手與輸出比例沒有對齊。BLG 7/23 用 Wenbo 上路以 2-1 擊敗 TT：G2 被 TT 在 28:34 拉出 9.8k 金差，證明 BLG 的替補上路／新版本首日並非無破口；但 G3 又以 27-13 擊殺、8-1 塔、4-0 龍、9k 金差收束，局間修正仍顯著優於 EDG。\n\n6/3 BLG 曾在 Patch 16.10 以 3-0 橫掃 EDG，三局只讓 EDG 拿到 4 座塔。該 H2H 的版本與中路／上路情境不同，不能直接複製比分，卻仍支持 BLG 在中野、下路與收尾的多點優勢。\n\n**取圖與反模型**\n\n- BLG 路徑一：Knight–Xun 取得中路先動，讓 Viper 穩定吃下河道與下半區資源。\n- BLG 路徑二：即使上路 Wenbo 只打弱側，BLG 仍可用 ON 的遊走與 Viper 的後期保底；若換回 Bin，上路主動性反而提高。\n- EDG 路徑一：Leave 拿到 Yunara／高資源 ADC，Xiaohao 全程保護下半區，Zdz 用低資源前排吸收 BP。\n- EDG 路徑二：利用 BLG 7/23 G2 的中期失誤，Bulldog 以控制法師先手，逼 BLG 在 Fearless 第二局進入較低熟練度組合。\n\nEDG 的兩條路徑足以支撐單局尾端，但都依賴中輔死亡率大幅改善，尚不足以把系列爆冷抬到主要情境。基準模型 BLG 89%、同賽事模型 84%、EDG 有利選邊反模型 BLG 76%，最大差距 13 個百分點；點估計 BLG 85%，敏感區間 76%–89%。"
    },
    {
      "heading": "6. 系列賽主分布、公允賠率與信心度",
      "markdown": "所有勝率、至少一局、橫掃與比分均由同一精確比分主分布推導；公允賠率為 `100 ÷ 機率百分比`。\n\n| 比賽（賽制） | 勝方 | 系列賽勝率 · 公允賠率 | 精確比分分布（比分 · 機率 · 公允賠率） |\n|---|---|---:|---|\n| AL–LGD（BO3） | Anyone's Legend | 77% · 1.30 | 2–0 · 45% · 2.22<br>2–1 · 32% · 3.13 |\n| AL–LGD（BO3） | LGD Gaming | 23% · 4.35 | 2–0 · 8% · 12.50<br>2–1 · 15% · 6.67 |\n| WE–JDG（BO3） | Team WE | 37% · 2.70 | 2–0 · 14% · 7.14<br>2–1 · 23% · 4.35 |\n| WE–JDG（BO3） | JD Gaming | 63% · 1.59 | 2–0 · 34% · 2.94<br>2–1 · 29% · 3.45 |\n| EDG–BLG（BO3） | EDward Gaming | 15% · 6.67 | 2–0 · 5% · 20.00<br>2–1 · 10% · 10.00 |\n| EDG–BLG（BO3） | Bilibili Gaming | 85% · 1.18 | 2–0 · 55% · 1.82<br>2–1 · 30% · 3.33 |\n\n- 至少贏一局：AL 92%／LGD 55%；WE 66%／JDG 86%；EDG 45%／BLG 95%。\n- 最可能比分：AL 2-0（45%）、JDG 2-0（34%）、BLG 2-0（55%）。\n\n**非補償式模型信心度**\n\n- AL–LGD：五項原始分數 82／94／90／55／60，加權原始值 79%；觸發「同賽事有效樣本少於三個系列、G1 選邊未定、關鍵 VOD 未完整複盤、反模型差 14%」。上限為完整度 82%、樣本 55%、穩定性+10=70%，最終 **55%**。\n- WE–JDG：82／94／91／58／67，加權原始值 80%；觸發同上，反模型差 11%。上限 82%／58%／77%，最終 **58%**。\n- EDG–BLG：82／94／70／60／67，加權原始值 76%；另有 BLG 上路輪替不確定。上限 82%／60%／77%，最終 **60%**。\n\n以上信心度是證據品質，不是勝率或投注把握。"
    },
    {
      "heading": "7. 推薦閘門與風險",
      "markdown": "**閘門結果（機率鎖定前不讀價格）**\n\n- AL–LGD：AL 勝方方向成立，但 LGD 已有中野節奏與下路收尾兩條取圖路徑，因此不把 AL -1.5 當高信心方向；LGD 至少一局 55%，不足以主推。\n- WE–JDG：WE 有兩條可重複取圖路徑，JDG 也有 GALA 後期與敗方選邊修正；打滿三局機率為 52%（WE 2-1 23% + JDG 2-1 29%），只屬五五附近，不足以在沒有價格時推薦 Over 2.5。\n- EDG–BLG：BLG 2-0 為單一最高結果，但 BLG 7/23 G2 失控與上路輪替讓 EDG 仍有 45% 至少一局；EDG 的兩條路徑都需要執行顯著改善，因此不推薦 EDG +1.5，只保留 live 觀察。\n\n**主要風險**\n\n- 當場先發：BLG 可能在 Wenbo／Bin 間輪替；WE 另有 Tyrion 打野選項；正式名單公布後需重算。\n- G1 選邊與 Fearless：BO3 的第一局權重高，敗方選邊與第二局英雄池會顯著改變打滿機率。\n- 版本推估：今日暫採 16.14；若賽事實際沿用 16.13，Azir、Yunara、Nami與藍 Buff判斷需回退。\n- 樣本：每隊在 Split 3 只有一個系列，近期數據極易受單一 draft、對手與長局影響。\n- 賽程與疲勞：AL、JDG、BLG 昨日剛打過系列；這同時帶來疲勞與更高版本資訊量，不能單向扣分。\n- 盤中波動：LGD、WE、EDG 都可能靠前期線權或單次巴龍建立優勢，但其系列收尾穩定度不同；不應用單局領先直接外推整個 BO3。"
    }
  ],
  "probability_groups": [
    {
      "id": "al_lgd_winner",
      "label": "AL vs LGD 系列賽勝方",
      "outcomes": [
        {"key": "al_win", "label": "Anyone's Legend", "probability": 77},
        {"key": "lgd_win", "label": "LGD Gaming", "probability": 23}
      ]
    },
    {
      "id": "al_lgd_score",
      "label": "AL vs LGD 精確比分",
      "outcomes": [
        {"key": "al_2_0", "label": "AL 2-0", "probability": 45},
        {"key": "al_2_1", "label": "AL 2-1", "probability": 32},
        {"key": "lgd_2_1", "label": "LGD 2-1", "probability": 15},
        {"key": "lgd_2_0", "label": "LGD 2-0", "probability": 8}
      ]
    },
    {
      "id": "we_jdg_winner",
      "label": "WE vs JDG 系列賽勝方",
      "outcomes": [
        {"key": "we_win", "label": "Team WE", "probability": 37},
        {"key": "jdg_win", "label": "JD Gaming", "probability": 63}
      ]
    },
    {
      "id": "we_jdg_score",
      "label": "WE vs JDG 精確比分",
      "outcomes": [
        {"key": "we_2_0", "label": "WE 2-0", "probability": 14},
        {"key": "we_2_1", "label": "WE 2-1", "probability": 23},
        {"key": "jdg_2_1", "label": "JDG 2-1", "probability": 29},
        {"key": "jdg_2_0", "label": "JDG 2-0", "probability": 34}
      ]
    },
    {
      "id": "edg_blg_winner",
      "label": "EDG vs BLG 系列賽勝方",
      "outcomes": [
        {"key": "edg_win", "label": "EDward Gaming", "probability": 15},
        {"key": "blg_win", "label": "Bilibili Gaming", "probability": 85}
      ]
    },
    {
      "id": "edg_blg_score",
      "label": "EDG vs BLG 精確比分",
      "outcomes": [
        {"key": "edg_2_0", "label": "EDG 2-0", "probability": 5},
        {"key": "edg_2_1", "label": "EDG 2-1", "probability": 10},
        {"key": "blg_2_1", "label": "BLG 2-1", "probability": 30},
        {"key": "blg_2_0", "label": "BLG 2-0", "probability": 55}
      ]
    }
  ],
  "confidence": {
    "value": 58,
    "rationale": "三場平均證據品質；原始加權約78%，但所有對戰在同賽事同版本都少於三個系列且 G1 選邊未定。頂層五項採全日非補償式上限後的有效分數，逐場原始分數與上限計算保留於正文。",
    "components": {
      "data_completeness": 58,
      "freshness": 58,
      "lineup_certainty": 58,
      "regime_relevance": 58,
      "model_stability": 58
    }
  },
  "key_factors": [
    {
      "evidence_ids": ["al_roster", "al_lgd_h2h", "lgd_recent"],
      "impact": "mixed",
      "reason": "AL 長期與 H2H 先驗較強，但 LGD 的 16.13/16.14 首戰內容更乾淨，壓低 AL 橫掃率。"
    },
    {
      "evidence_ids": ["we_roster", "we_playoffs", "jdg_recent"],
      "impact": "mixed",
      "reason": "WE 有季後賽爆冷上限，JDG 有較穩的 GALA 後期勝點；兩隊近期都暴露前中期波動。"
    },
    {
      "evidence_ids": ["edg_recent", "blg_recent", "blg_edg_h2h"],
      "impact": "positive",
      "reason": "BLG 的多點優勢與局間修正明顯，EDG 新中路與輔助協同尚未成形。"
    },
    {
      "evidence_ids": ["patch_official"],
      "impact": "uncertainty",
      "reason": "16.14 對 Azir、Yunara、Nami與藍 Buff的變動有利成熟中野與下路體系，但今日逐場版本尚未在賽事頁正式填入。"
    }
  ],
  "risks": [
    "三場 Game 1 選邊未確認，會影響 BO3 首局與敗方修正。",
    "BLG 今日上路可能在 Wenbo 與 Bin 間輪替。",
    "同版本同賽事只有一個系列，模型對單一 draft 與長局敏感。",
    "官方全長 VOD 未逐場完整複盤，BP與局內數據權重高於主觀影像判讀。",
    "正式版本若不是16.14需建立新版快照。"
  ],
  "missing_data": [
    "當場正式先發與 G1 選邊",
    "今日逐場正式比賽版本",
    "近期每支隊伍的完整官方全長 VOD 複盤"
  ]
}
